{
  "artifact_version": "gate3.prior-authority-fixture.v1",
  "fixture_id": "FIXTURE-G3-USER-008-PRIOR-AUTHORITY-V1",
  "fixture_uri": "fixture://wajegame/run-evidence-repair/v1",
  "episode_id": "G3-USER-008",
  "source_authority_id": "FIXTURE-WAJE-RUN-EVIDENCE-REPAIR-V1",
  "evaluation_clock": {
    "as_of_instant": "2026-06-03T10:00:00+01:00",
    "target_business_date": "2026-06-02",
    "business_timezone": "Africa/Lagos",
    "release_cutoff_instant": "2026-06-03T09:30:00+01:00"
  },
  "accepted_authority": {
    "case_ref": "case:g3-user-008-prior",
    "analysis_cycle_ref": "cycle:g3-user-008-cycle-1",
    "question_revision_ref": "question:qrev-g3-user-008-1",
    "frame_revision_ref": "frame:frev-g3-user-008-1",
    "plan_revision_ref": "plan:prev-g3-user-008-1"
  },
  "object_inventory": [
    {
      "object_ref": "question:qrev-g3-user-008-1",
      "object_type": "question_revision",
      "version": 1,
      "prior_object_ref": null,
      "recorded_at": "2026-06-03T08:31:00+01:00",
      "immutability": "append_only",
      "authority_refs": [
        "case:g3-user-008-prior"
      ],
      "facts": [
        "Compare successful paid amount on 2026-06-02 with the accepted baseline and identify the largest channel increment."
      ]
    },
    {
      "object_ref": "frame:frev-g3-user-008-1",
      "object_type": "analysis_frame_revision",
      "version": 1,
      "prior_object_ref": null,
      "recorded_at": "2026-06-03T08:31:10+01:00",
      "immutability": "append_only",
      "authority_refs": [
        "case:g3-user-008-prior",
        "question:qrev-g3-user-008-1"
      ],
      "facts": [
        "Observation unit is one canonical payment order.",
        "Successful paid amount uses the accepted terminal-success and deduplication contracts.",
        "Channel attribution is descriptive and cannot exceed the observed mapping coverage."
      ]
    },
    {
      "object_ref": "plan:prev-g3-user-008-1",
      "object_type": "work_plan_revision",
      "version": 1,
      "prior_object_ref": null,
      "recorded_at": "2026-06-03T08:31:20+01:00",
      "immutability": "append_only",
      "authority_refs": [
        "case:g3-user-008-prior",
        "frame:frev-g3-user-008-1"
      ],
      "facts": [
        "Task one computes target and baseline successful paid amount.",
        "Task two ranks channel increments after applying the same payment population."
      ]
    },
    {
      "object_ref": "query:qspec-g3-user-008-initial-1",
      "object_type": "query_spec",
      "version": 1,
      "prior_object_ref": null,
      "recorded_at": "2026-06-03T08:32:00+01:00",
      "immutability": "append_only",
      "authority_refs": [
        "frame:frev-g3-user-008-1",
        "plan:prev-g3-user-008-1",
        "snapshot:paid-success-20260602-release-0930"
      ],
      "facts": [
        "The query returns successful paid amount by target or baseline period and attributed channel.",
        "The initial execution failed to remove a repeated Channel A order event."
      ]
    },
    {
      "object_ref": "result:result-g3-user-008-initial-1",
      "object_type": "result_handle",
      "version": 1,
      "prior_object_ref": null,
      "recorded_at": "2026-06-03T08:33:00+01:00",
      "immutability": "append_only",
      "authority_refs": [
        "query:qspec-g3-user-008-initial-1",
        "snapshot:paid-success-20260602-release-0930"
      ],
      "facts": [
        "Baseline successful paid amount is NGN 1000.",
        "Initial target successful paid amount is NGN 1300.",
        "Initial target growth is 30 percent.",
        "Channel A appears as the largest increment."
      ]
    },
    {
      "object_ref": "evidence:evidence-g3-user-008-total-1",
      "object_type": "evidence_record",
      "version": 1,
      "prior_object_ref": null,
      "recorded_at": "2026-06-03T08:34:00+01:00",
      "immutability": "append_only",
      "authority_refs": [
        "frame:frev-g3-user-008-1",
        "plan:prev-g3-user-008-1",
        "query:qspec-g3-user-008-initial-1",
        "result:result-g3-user-008-initial-1",
        "snapshot:paid-success-20260602-release-0930"
      ],
      "facts": [
        "The initial total-amount evidence supports a 30 percent increase before repair."
      ]
    },
    {
      "object_ref": "evidence:evidence-g3-user-008-channel-1",
      "object_type": "evidence_record",
      "version": 1,
      "prior_object_ref": null,
      "recorded_at": "2026-06-03T08:34:10+01:00",
      "immutability": "append_only",
      "authority_refs": [
        "frame:frev-g3-user-008-1",
        "plan:prev-g3-user-008-1",
        "query:qspec-g3-user-008-initial-1",
        "result:result-g3-user-008-initial-1",
        "snapshot:paid-success-20260602-release-0930"
      ],
      "facts": [
        "The initial channel evidence ranks Channel A first before duplicate removal and mapping sensitivity."
      ]
    },
    {
      "object_ref": "answer:answer-g3-user-008-1",
      "object_type": "answer_version",
      "version": 1,
      "prior_object_ref": null,
      "recorded_at": "2026-06-03T08:35:00+01:00",
      "immutability": "append_only",
      "authority_refs": [
        "frame:frev-g3-user-008-1",
        "plan:prev-g3-user-008-1",
        "evidence:evidence-g3-user-008-total-1",
        "evidence:evidence-g3-user-008-channel-1"
      ],
      "facts": [
        "The initial answer says total successful paid amount increased 30 percent.",
        "The initial answer says Channel A is the largest increment channel."
      ],
      "answer_status": "provisional"
    },
    {
      "object_ref": "workflow:workflow-g3-user-008-1",
      "object_type": "workflow_projection",
      "version": 1,
      "prior_object_ref": null,
      "recorded_at": "2026-06-03T08:35:10+01:00",
      "immutability": "append_only",
      "authority_refs": [
        "answer:answer-g3-user-008-1"
      ],
      "facts": [
        "The first answer is visible inside the evaluation workflow and remains in Gate 3."
      ],
      "workflow_state": "provisional",
      "delivery_state": "withheld"
    },
    {
      "object_ref": "result:result-g3-user-008-repair-2",
      "object_type": "result_handle",
      "version": 2,
      "prior_object_ref": "result:result-g3-user-008-initial-1",
      "recorded_at": "2026-06-03T09:47:00+01:00",
      "immutability": "append_only",
      "authority_refs": [
        "query:qspec-g3-user-008-initial-1",
        "snapshot:paid-success-20260602-release-0930",
        "event:correction-g3-user-008-1"
      ],
      "facts": [
        "NGN 150 of repeated Channel A amount is removed.",
        "Repaired target successful paid amount is NGN 1150.",
        "Repaired target growth is 15 percent.",
        "Channel mapping uncertainty can reverse the channel ranking."
      ]
    },
    {
      "object_ref": "evidence:evidence-g3-user-008-total-2",
      "object_type": "evidence_record",
      "version": 2,
      "prior_object_ref": "evidence:evidence-g3-user-008-total-1",
      "recorded_at": "2026-06-03T09:48:00+01:00",
      "immutability": "append_only",
      "authority_refs": [
        "frame:frev-g3-user-008-1",
        "plan:prev-g3-user-008-1",
        "query:qspec-g3-user-008-initial-1",
        "result:result-g3-user-008-repair-2",
        "snapshot:paid-success-20260602-release-0930"
      ],
      "facts": [
        "The repaired total-amount evidence supports a 15 percent increase and supersedes the initial magnitude."
      ]
    },
    {
      "object_ref": "evidence:evidence-g3-user-008-channel-quality-2",
      "object_type": "evidence_record",
      "version": 2,
      "prior_object_ref": "evidence:evidence-g3-user-008-channel-1",
      "recorded_at": "2026-06-03T09:48:10+01:00",
      "immutability": "append_only",
      "authority_refs": [
        "frame:frev-g3-user-008-1",
        "plan:prev-g3-user-008-1",
        "result:result-g3-user-008-repair-2",
        "contract:paid-order-detail-source-0.4"
      ],
      "facts": [
        "Blank and Unknown channel values plus high-value payer sensitivity can change the channel ranking.",
        "The channel defect does not invalidate the full-sample total amount."
      ]
    },
    {
      "object_ref": "answer:answer-g3-user-008-2",
      "object_type": "answer_version",
      "version": 2,
      "prior_object_ref": "answer:answer-g3-user-008-1",
      "recorded_at": "2026-06-03T09:50:00+01:00",
      "immutability": "append_only",
      "authority_refs": [
        "frame:frev-g3-user-008-1",
        "plan:prev-g3-user-008-1",
        "evidence:evidence-g3-user-008-total-2",
        "evidence:evidence-g3-user-008-channel-quality-2"
      ],
      "facts": [
        "The repaired answer keeps the positive total direction, revises growth to 15 percent and withholds the Channel A ranking."
      ],
      "answer_status": "provisional"
    },
    {
      "object_ref": "workflow:workflow-g3-user-008-2",
      "object_type": "workflow_projection",
      "version": 2,
      "prior_object_ref": "workflow:workflow-g3-user-008-1",
      "recorded_at": "2026-06-03T09:50:10+01:00",
      "immutability": "append_only",
      "authority_refs": [
        "answer:answer-g3-user-008-2"
      ],
      "facts": [
        "The workflow points at the repaired answer and retains the full prior chronology."
      ],
      "workflow_state": "provisional",
      "delivery_state": "withheld"
    }
  ],
  "journal_object_refs": [
    "event:ingress-g3-user-008-1",
    "event:frame-accepted-g3-user-008-1",
    "event:plan-accepted-g3-user-008-1",
    "event:initial-effect-g3-user-008-1",
    "event:initial-evidence-g3-user-008-1",
    "event:initial-review-g3-user-008-1",
    "event:initial-disposition-g3-user-008-1",
    "event:initial-answer-g3-user-008-1",
    "event:initial-workflow-g3-user-008-1",
    "event:repair-effect-g3-user-008-2",
    "event:repair-evidence-g3-user-008-2",